"No.","Time","Source","Destination","Protocol","Length","Info","RTT"
"36","1.661915","151.101.65.140","10.100.102.10","TCP","60","443  >  51446 [ACK] Seq=1 Ack=1507 Win=422 Len=0","0.069231000"
"39","1.760244","10.100.102.10","151.101.65.140","TCP","54","51446  >  443 [ACK] Seq=1507 Ack=2248 Win=1028 Len=0","0.000222000"
"42","1.761499","10.100.102.10","151.101.65.140","TCP","54","51446  >  443 [ACK] Seq=1507 Ack=4477 Win=1028 Len=0","0.000130000"
"45","1.835154","10.100.102.10","151.101.65.140","TCP","54","51446  >  443 [ACK] Seq=1507 Ack=7277 Win=1028 Len=0","0.000267000"
"48","1.835643","10.100.102.10","151.101.65.140","TCP","54","51446  >  443 [ACK] Seq=1507 Ack=10077 Win=1028 Len=0","0.000107000"
"51","1.836163","10.100.102.10","151.101.65.140","TCP","54","51446  >  443 [ACK] Seq=1507 Ack=12877 Win=1028 Len=0","0.000086000"
"54","1.837116","10.100.102.10","151.101.65.140","TCP","54","51446  >  443 [ACK] Seq=1507 Ack=15677 Win=1028 Len=0","0.000103000"
"58","1.837619","10.100.102.10","151.101.65.140","TCP","54","51446  >  443 [ACK] Seq=1507 Ack=18477 Win=1028 Len=0","0.000188000"
"66","1.841135","10.100.102.10","151.101.65.140","TCP","66","51446  >  443 [ACK] Seq=1507 Ack=18694 Win=1027 Len=0 SLE=20094 SRE=21494","0.000166000"
"67","1.841266","10.100.102.10","151.101.65.140","TCP","54","51446  >  443 [ACK] Seq=1507 Ack=21494 Win=1028 Len=0","0.000297000"
"68","1.841372","10.100.102.10","151.101.65.140","TCP","54","51446  >  443 [ACK] Seq=1507 Ack=27094 Win=1028 Len=0","0.000403000"
"71","1.842353","10.100.102.10","151.101.65.140","TCP","54","51446  >  443 [ACK] Seq=1507 Ack=29894 Win=1028 Len=0","0.000135000"
"74","1.842829","10.100.102.10","151.101.65.140","TCP","54","51446  >  443 [ACK] Seq=1507 Ack=32694 Win=1028 Len=0","0.000109000"
"77","1.845736","10.100.102.10","151.101.65.140","TCP","54","51446  >  443 [ACK] Seq=1507 Ack=35125 Win=1028 Len=0","0.000116000"
"82","1.910849","10.100.102.10","151.101.65.140","TCP","54","51446  >  443 [ACK] Seq=1507 Ack=40725 Win=1028 Len=0","0.000375000"
"87","1.911729","10.100.102.10","151.101.65.140","TCP","54","51446  >  443 [ACK] Seq=1507 Ack=46325 Win=1028 Len=0","0.000275000"
"93","1.913820","10.100.102.10","151.101.65.140","TCP","54","51446  >  443 [ACK] Seq=1507 Ack=49125 Win=1028 Len=0","0.000244000"
"94","1.913873","10.100.102.10","151.101.65.140","TCP","54","51446  >  443 [ACK] Seq=1507 Ack=51925 Win=1028 Len=0","0.000297000"
"99","1.915360","10.100.102.10","151.101.65.140","TCP","54","51446  >  443 [ACK] Seq=1507 Ack=57525 Win=1028 Len=0","0.000142000"
"102","1.915597","10.100.102.10","151.101.65.140","TCP","54","51446  >  443 [ACK] Seq=1507 Ack=60325 Win=1028 Len=0","0.000092000"
"107","1.939266","10.100.102.10","151.101.65.140","TCP","54","51446  >  443 [ACK] Seq=1507 Ack=63277 Win=1028 Len=0","0.000166000"
"112","1.942484","10.100.102.10","151.101.65.140","TCP","54","51446  >  443 [ACK] Seq=1507 Ack=65078 Win=1028 Len=0","0.000294000"
"113","1.985054","10.100.102.10","151.101.65.140","TCP","54","51446  >  443 [ACK] Seq=1507 Ack=65183 Win=1027 Len=0","0.042864000"
"123","2.135566","10.100.102.10","151.101.65.140","TCP","54","51446  >  443 [ACK] Seq=1507 Ack=65554 Win=1026 Len=0","0.000149000"
"126","2.173151","10.100.102.10","151.101.65.140","TCP","54","51446  >  443 [ACK] Seq=1507 Ack=65796 Win=1025 Len=0","0.000111000"
"132","2.198396","10.100.102.10","151.101.65.140","TCP","54","51446  >  443 [ACK] Seq=1507 Ack=65964 Win=1024 Len=0","0.000149000"
"135","2.211473","10.100.102.10","151.101.65.140","TCP","54","51446  >  443 [ACK] Seq=1507 Ack=66144 Win=1023 Len=0","0.000170000"
"139","2.215458","10.100.102.10","151.101.65.140","TCP","54","51446  >  443 [ACK] Seq=1507 Ack=66382 Win=1023 Len=0","0.000139000"
"142","2.219416","10.100.102.10","151.101.65.140","TCP","54","51446  >  443 [ACK] Seq=1507 Ack=66555 Win=1028 Len=0","0.000154000"
"144","2.220648","10.100.102.10","151.101.65.140","TCP","54","51446  >  443 [ACK] Seq=1507 Ack=66693 Win=1027 Len=0","0.000122000"
"147","2.236237","10.100.102.10","151.101.65.140","TCP","54","51446  >  443 [ACK] Seq=1507 Ack=67055 Win=1026 Len=0","0.000084000"
"153","2.262583","10.100.102.10","151.101.65.140","TCP","54","51446  >  443 [ACK] Seq=1507 Ack=67733 Win=1023 Len=0","0.000058000"
"160","2.275704","10.100.102.10","151.101.65.140","TCP","54","51446  >  443 [ACK] Seq=1507 Ack=68027 Win=1028 Len=0","0.000184000"
"163","2.285130","10.100.102.10","151.101.65.140","TCP","54","51446  >  443 [ACK] Seq=1507 Ack=69687 Win=1028 Len=0","0.000141000"
"166","2.305089","10.100.102.10","151.101.65.140","TCP","54","51446  >  443 [ACK] Seq=1507 Ack=70788 Win=1023 Len=0","0.000112000"
"176","2.349993","10.100.102.10","151.101.65.140","TCP","54","51446  >  443 [ACK] Seq=1507 Ack=71627 Win=1028 Len=0","0.000246000"
"179","2.355619","10.100.102.10","151.101.65.140","TCP","54","51446  >  443 [ACK] Seq=1507 Ack=72641 Win=1024 Len=0","0.000116000"
"182","2.361957","10.100.102.10","151.101.65.140","TCP","54","51446  >  443 [ACK] Seq=1507 Ack=73063 Win=1028 Len=0","0.000120000"
"186","2.383509","10.100.102.10","151.101.65.140","TCP","54","51446  >  443 [ACK] Seq=1507 Ack=73362 Win=1026 Len=0","0.000090000"
"189","2.395467","10.100.102.10","151.101.65.140","TCP","54","51446  >  443 [ACK] Seq=1507 Ack=75399 Win=1028 Len=0","0.000127000"
"193","2.403738","10.100.102.10","151.101.65.140","TCP","54","51446  >  443 [ACK] Seq=1507 Ack=76493 Win=1023 Len=0","0.000188000"
"196","2.412909","10.100.102.10","151.101.65.140","TCP","54","51446  >  443 [ACK] Seq=1507 Ack=76788 Win=1022 Len=0","0.000145000"
"199","2.416100","10.100.102.10","151.101.65.140","TCP","54","51446  >  443 [ACK] Seq=1507 Ack=77184 Win=1028 Len=0","0.000123000"
"202","2.420520","10.100.102.10","151.101.65.140","TCP","54","51446  >  443 [ACK] Seq=1507 Ack=77566 Win=1026 Len=0","0.000189000"
"205","2.449168","10.100.102.10","151.101.65.140","TCP","54","51446  >  443 [ACK] Seq=1507 Ack=77781 Win=1025 Len=0","0.000094000"
"208","2.470720","10.100.102.10","151.101.65.140","TCP","54","51446  >  443 [ACK] Seq=1507 Ack=78368 Win=1023 Len=0","0.000123000"
"211","2.480422","10.100.102.10","151.101.65.140","TCP","54","51446  >  443 [ACK] Seq=1507 Ack=78616 Win=1028 Len=0","0.000113000"
"214","2.483604","10.100.102.10","151.101.65.140","TCP","54","51446  >  443 [ACK] Seq=1507 Ack=78887 Win=1027 Len=0","0.000145000"
"217","2.488093","10.100.102.10","151.101.65.140","TCP","54","51446  >  443 [ACK] Seq=1507 Ack=79155 Win=1026 Len=0","0.000172000"
"221","2.511301","10.100.102.10","151.101.65.140","TCP","54","51446  >  443 [ACK] Seq=1507 Ack=79437 Win=1024 Len=0","0.000127000"
"226","2.518791","10.100.102.10","151.101.65.140","TCP","54","51446  >  443 [ACK] Seq=1507 Ack=79856 Win=1023 Len=0","0.000121000"
"229","2.522732","10.100.102.10","151.101.65.140","TCP","54","51446  >  443 [ACK] Seq=1507 Ack=80135 Win=1028 Len=0","0.000093000"
"237","2.537023","10.100.102.10","151.101.65.140","TCP","54","51446  >  443 [ACK] Seq=1507 Ack=80346 Win=1027 Len=0","0.000087000"
"240","2.542834","10.100.102.10","151.101.65.140","TCP","54","51446  >  443 [ACK] Seq=1507 Ack=80424 Win=1026 Len=0","0.000160000"
"243","2.545655","10.100.102.10","151.101.65.140","TCP","54","51446  >  443 [ACK] Seq=1507 Ack=80734 Win=1025 Len=0","0.000129000"
"246","2.548407","10.100.102.10","151.101.65.140","TCP","54","51446  >  443 [ACK] Seq=1507 Ack=81006 Win=1024 Len=0","0.000112000"
"256","2.578470","10.100.102.10","151.101.65.140","TCP","54","51446  >  443 [ACK] Seq=1507 Ack=82331 Win=1028 Len=0","0.000262000"
"260","2.593963","10.100.102.10","151.101.65.140","TCP","54","51446  >  443 [ACK] Seq=1507 Ack=82648 Win=1026 Len=0","0.000112000"
"264","2.599617","10.100.102.10","151.101.65.140","TCP","54","51446  >  443 [ACK] Seq=1507 Ack=83140 Win=1024 Len=0","0.000108000"
"268","2.611010","10.100.102.10","151.101.65.140","TCP","54","51446  >  443 [ACK] Seq=1507 Ack=83347 Win=1024 Len=0","0.000185000"
"271","2.613346","10.100.102.10","151.101.65.140","TCP","54","51446  >  443 [ACK] Seq=1507 Ack=83553 Win=1023 Len=0","0.000142000"
"274","2.614843","10.100.102.10","151.101.65.140","TCP","54","51446  >  443 [ACK] Seq=1507 Ack=83752 Win=1028 Len=0","0.000091000"
"277","2.627807","10.100.102.10","151.101.65.140","TCP","54","51446  >  443 [ACK] Seq=1507 Ack=84316 Win=1025 Len=0","0.000142000"
"281","2.653519","10.100.102.10","151.101.65.140","TCP","54","51446  >  443 [ACK] Seq=1507 Ack=84517 Win=1025 Len=0","0.000209000"
"284","2.664875","10.100.102.10","151.101.65.140","TCP","54","51446  >  443 [ACK] Seq=1507 Ack=84924 Win=1023 Len=0","0.000106000"
"295","2.686026","10.100.102.10","151.101.65.140","TCP","54","51446  >  443 [ACK] Seq=1507 Ack=85916 Win=1028 Len=0","0.000227000"
"299","2.690282","10.100.102.10","151.101.65.140","TCP","54","51446  >  443 [ACK] Seq=1507 Ack=86221 Win=1026 Len=0","0.000161000"
"302","2.699595","10.100.102.10","151.101.65.140","TCP","54","51446  >  443 [ACK] Seq=1507 Ack=86718 Win=1024 Len=0","0.000108000"
"305","2.703774","10.100.102.10","151.101.65.140","TCP","54","51446  >  443 [ACK] Seq=1507 Ack=86929 Win=1024 Len=0","0.000112000"
"309","2.714788","10.100.102.10","151.101.65.140","TCP","54","51446  >  443 [ACK] Seq=1507 Ack=87212 Win=1023 Len=0","0.000139000"
"312","2.716815","10.100.102.10","151.101.65.140","TCP","54","51446  >  443 [ACK] Seq=1507 Ack=87406 Win=1028 Len=0","0.000132000"
"314","2.718963","10.100.102.10","151.101.65.140","TCP","54","51446  >  443 [ACK] Seq=1507 Ack=87597 Win=1027 Len=0","0.000152000"
"317","2.722042","10.100.102.10","151.101.65.140","TCP","54","51446  >  443 [ACK] Seq=1507 Ack=88468 Win=1023 Len=0","0.000090000"
"323","2.732500","10.100.102.10","151.101.65.140","TCP","54","51446  >  443 [ACK] Seq=1507 Ack=90775 Win=1028 Len=0","0.000207000"
"325","2.736233","10.100.102.10","151.101.65.140","TCP","54","51446  >  443 [ACK] Seq=1507 Ack=91319 Win=1026 Len=0","0.000151000"
"329","2.740267","10.100.102.10","151.101.65.140","TCP","54","51446  >  443 [ACK] Seq=1507 Ack=92230 Win=1028 Len=0","0.000151000"
"349","2.744248","10.100.102.10","151.101.65.140","TCP","54","51446  >  443 [ACK] Seq=1507 Ack=92889 Win=1025 Len=0","0.000122000"
"352","2.762488","10.100.102.10","151.101.65.140","TCP","54","51446  >  443 [ACK] Seq=1507 Ack=93081 Win=1024 Len=0","0.000138000"
"356","2.770294","10.100.102.10","151.101.65.140","TCP","54","51446  >  443 [ACK] Seq=1507 Ack=93456 Win=1023 Len=0","0.000181000"
"360","2.775353","10.100.102.10","151.101.65.140","TCP","54","51446  >  443 [ACK] Seq=1507 Ack=94129 Win=1028 Len=0","0.000147000"
"365","2.786581","10.100.102.10","151.101.65.140","TCP","54","51446  >  443 [ACK] Seq=1507 Ack=94659 Win=1026 Len=0","0.000184000"
"369","3.027645","151.101.65.140","10.100.102.10","TCP","60","443  >  51446 [ACK] Seq=94659 Ack=1841 Win=424 Len=0","0.070615000"
"375","3.027903","10.100.102.10","151.101.65.140","TCP","66","51446  >  443 [ACK] Seq=1841 Ack=94852 Win=1025 Len=0 SLE=96252 SRE=97652","0.000258000"
"376","3.028124","10.100.102.10","151.101.65.140","TCP","54","51446  >  443 [ACK] Seq=1841 Ack=97652 Win=1028 Len=0","0.000479000"
"377","3.028214","10.100.102.10","151.101.65.140","TCP","54","51446  >  443 [ACK] Seq=1841 Ack=99941 Win=1028 Len=0","0.000569000"
"610","4.505526","151.101.65.140","10.100.102.10","TCP","60","443  >  51446 [ACK] Seq=99941 Ack=2076 Win=424 Len=0","0.068440000"
"611","4.505526","151.101.65.140","10.100.102.10","TCP","60","443  >  51446 [ACK] Seq=99941 Ack=2570 Win=424 Len=0","0.068340000"
"612","4.528492","151.101.65.140","10.100.102.10","TCP","60","443  >  51446 [ACK] Seq=99941 Ack=2731 Win=424 Len=0","0.073474000"
"643","4.603414","151.101.65.140","10.100.102.10","TCP","60","443  >  51446 [ACK] Seq=99941 Ack=2950 Win=424 Len=0","0.070259000"
"670","4.612730","10.100.102.10","151.101.65.140","TCP","54","51446  >  443 [ACK] Seq=2950 Ack=101632 Win=1028 Len=0","0.000184000"
"683","4.834368","10.100.102.10","151.101.65.140","TCP","54","51446  >  443 [ACK] Seq=2950 Ack=103781 Win=1028 Len=0","0.000264000"
"686","4.927238","10.100.102.10","151.101.65.140","TCP","54","51446  >  443 [ACK] Seq=2950 Ack=105457 Win=1028 Len=0","0.000152000"
"689","4.938601","10.100.102.10","151.101.65.140","TCP","54","51446  >  443 [ACK] Seq=2950 Ack=106357 Win=1024 Len=0","0.000109000"
"692","4.939620","10.100.102.10","151.101.65.140","TCP","54","51446  >  443 [ACK] Seq=2950 Ack=107519 Win=1028 Len=0","0.000140000"
"696","4.940184","10.100.102.10","151.101.65.140","TCP","54","51446  >  443 [ACK] Seq=2950 Ack=108599 Win=1023 Len=0","0.000134000"
"700","5.004847","10.100.102.10","151.101.65.140","TCP","54","51446  >  443 [ACK] Seq=2950 Ack=110660 Win=1028 Len=0","0.000251000"
"707","5.174175","151.101.65.140","10.100.102.10","TCP","60","443  >  51446 [ACK] Seq=110660 Ack=3345 Win=424 Len=0","0.069590000"
"709","5.298736","151.101.65.140","10.100.102.10","TCP","60","443  >  51446 [ACK] Seq=110660 Ack=3489 Win=424 Len=0","0.067660000"
"712","5.388642","10.100.102.10","151.101.65.140","TCP","54","51446  >  443 [ACK] Seq=3489 Ack=112853 Win=1028 Len=0","0.000071000"
"717","5.620582","10.100.102.10","151.101.65.140","TCP","54","51446  >  443 [ACK] Seq=3489 Ack=114575 Win=1028 Len=0","0.000140000"
"816","6.144787","10.100.102.10","151.101.65.140","TCP","54","51446  >  443 [ACK] Seq=3489 Ack=116145 Win=1028 Len=0","0.000121000"
"819","6.148196","10.100.102.10","151.101.65.140","TCP","54","51446  >  443 [ACK] Seq=3489 Ack=117190 Win=1024 Len=0","0.000118000"
"823","6.149565","10.100.102.10","151.101.65.140","TCP","54","51446  >  443 [ACK] Seq=3489 Ack=118945 Win=1028 Len=0","0.000220000"
"841","6.160006","10.100.102.10","151.101.65.140","TCP","54","51446  >  443 [ACK] Seq=3489 Ack=119299 Win=1026 Len=0","0.000113000"
"849","6.162339","10.100.102.10","151.101.65.140","TCP","54","51446  >  443 [ACK] Seq=3489 Ack=120802 Win=1028 Len=0","0.000074000"
"861","6.195048","10.100.102.10","151.101.65.140","TCP","54","51446  >  443 [ACK] Seq=3489 Ack=122977 Win=1028 Len=0","0.000130000"
"863","6.197103","10.100.102.10","151.101.65.140","TCP","54","51446  >  443 [ACK] Seq=3489 Ack=123204 Win=1027 Len=0","0.000152000"
"867","6.213767","10.100.102.10","151.101.65.140","TCP","54","51446  >  443 [ACK] Seq=3489 Ack=125820 Win=1028 Len=0","0.000264000"
"870","6.227778","10.100.102.10","151.101.65.140","TCP","54","51446  >  443 [ACK] Seq=3489 Ack=127680 Win=1028 Len=0","0.000177000"
"875","6.228741","10.100.102.10","151.101.65.140","TCP","54","51446  >  443 [ACK] Seq=3489 Ack=130313 Win=1028 Len=0","0.000129000"
"883","6.230808","10.100.102.10","151.101.65.140","TCP","66","51446  >  443 [ACK] Seq=3489 Ack=131239 Win=1024 Len=0 SLE=131626 SRE=132031","0.000288000"
"885","6.231065","10.100.102.10","151.101.65.140","TCP","54","51446  >  443 [ACK] Seq=3489 Ack=133402 Win=1028 Len=0","0.000545000"
"886","6.231146","10.100.102.10","151.101.65.140","TCP","54","51446  >  443 [ACK] Seq=3489 Ack=135684 Win=1028 Len=0","0.000626000"
"889","6.237300","10.100.102.10","151.101.65.140","TCP","54","51446  >  443 [ACK] Seq=3489 Ack=136514 Win=1024 Len=0","0.000155000"
"891","6.238118","10.100.102.10","151.101.65.140","TCP","54","51446  >  443 [ACK] Seq=3489 Ack=136921 Win=1023 Len=0","0.000197000"
"896","6.240094","10.100.102.10","151.101.65.140","TCP","66","51446  >  443 [ACK] Seq=3489 Ack=137035 Win=1022 Len=0 SLE=137378 SRE=137948","0.000966000"
"897","6.240175","10.100.102.10","151.101.65.140","TCP","54","51446  >  443 [ACK] Seq=3489 Ack=137948 Win=1028 Len=0","0.000157000"
"898","6.240217","10.100.102.10","151.101.65.140","TCP","54","51446  >  443 [ACK] Seq=3489 Ack=138428 Win=1026 Len=0","0.000199000"
"902","6.245335","10.100.102.10","151.101.65.140","TCP","54","51446  >  443 [ACK] Seq=3489 Ack=140802 Win=1028 Len=0","0.000154000"
"904","6.246571","10.100.102.10","151.101.65.140","TCP","54","51446  >  443 [ACK] Seq=3489 Ack=141001 Win=1027 Len=0","0.000123000"
"907","6.278548","10.100.102.10","151.101.65.140","TCP","54","51446  >  443 [ACK] Seq=3489 Ack=143801 Win=1028 Len=0","0.000145000"
"910","6.280645","10.100.102.10","151.101.65.140","TCP","54","51446  >  443 [ACK] Seq=3489 Ack=145299 Win=1028 Len=0","0.000175000"
"917","6.294892","10.100.102.10","151.101.65.140","TCP","54","51446  >  443 [ACK] Seq=3489 Ack=147960 Win=1028 Len=0","0.000288000"
"918","6.294997","10.100.102.10","151.101.65.140","TCP","54","51446  >  443 [ACK] Seq=3489 Ack=150623 Win=1028 Len=0","0.000393000"
"924","6.321503","10.100.102.10","151.101.65.140","TCP","66","51446  >  443 [ACK] Seq=3489 Ack=153423 Win=1028 Len=0 SLE=154823 SRE=155408","0.000167000"
"925","6.321626","10.100.102.10","151.101.65.140","TCP","54","51446  >  443 [ACK] Seq=3489 Ack=155408 Win=1028 Len=0","0.000290000"
"24779","8.834893","151.101.65.140","10.100.102.10","TCP","66","80  >  51540 [ACK] Seq=1 Ack=2 Win=290 Len=0 SLE=1 SRE=2","0.061773000"
"25095","10.111912","151.101.65.140","10.100.102.10","TCP","60","443  >  51446 [ACK] Seq=155408 Ack=3796 Win=424 Len=0","0.066771000"
"25096","10.114016","151.101.65.140","10.100.102.10","TCP","60","443  >  51446 [ACK] Seq=155408 Ack=6596 Win=424 Len=0","0.068552000"
"25097","10.114016","151.101.65.140","10.100.102.10","TCP","60","443  >  51446 [ACK] Seq=155408 Ack=9396 Win=424 Len=0","0.068552000"
"25098","10.115092","151.101.65.140","10.100.102.10","TCP","60","443  >  51446 [ACK] Seq=155408 Ack=10515 Win=424 Len=0","0.069628000"
"25101","10.215866","10.100.102.10","151.101.65.140","TCP","54","51446  >  443 [ACK] Seq=10515 Ack=157600 Win=1028 Len=0","0.000201000"
"25176","10.787146","151.101.65.140","10.100.102.10","TCP","60","443  >  51446 [ACK] Seq=157600 Ack=12128 Win=421 Len=0","0.067354000"
"25177","10.789524","151.101.65.140","10.100.102.10","TCP","60","443  >  51446 [ACK] Seq=157600 Ack=14189 Win=424 Len=0","0.069572000"
"25181","10.995294","10.100.102.10","151.101.65.140","TCP","54","51446  >  443 [ACK] Seq=14189 Ack=159452 Win=1028 Len=0","0.000177000"
"25183","11.049162","10.100.102.10","151.101.65.140","TCP","66","[TCP Dup ACK 25181#1] 51446  >  443 [ACK] Seq=14189 Ack=159452 Win=1028 Len=0 SLE=159000 SRE=159452","0.000064000"
"25395","13.221905","151.101.65.140","10.100.102.10","TCP","60","443  >  51446 [ACK] Seq=159452 Ack=14534 Win=424 Len=0","0.067212000"
"25396","13.222471","151.101.65.140","10.100.102.10","TCP","60","443  >  51446 [ACK] Seq=159452 Ack=17334 Win=424 Len=0","0.067665000"
"25397","13.223269","151.101.65.140","10.100.102.10","TCP","60","443  >  51446 [ACK] Seq=159452 Ack=20285 Win=424 Len=0","0.068463000"
"25405","13.315914","10.100.102.10","151.101.65.140","TCP","54","51446  >  443 [ACK] Seq=20285 Ack=161645 Win=1028 Len=0","0.000196000"
"25420","13.513868","151.101.65.140","10.100.102.10","TCP","60","80  >  51540 [ACK] Seq=1 Ack=3 Win=290 Len=0","0.061764000"
"25422","13.513975","10.100.102.10","151.101.65.140","TCP","54","51540  >  80 [ACK] Seq=3 Ack=2 Win=1023 Len=0","0.000107000"
"35969","16.318657","151.101.65.140","10.100.102.10","TCP","60","443  >  51446 [ACK] Seq=161645 Ack=20756 Win=424 Len=0","0.081134000"
"35970","16.319011","151.101.65.140","10.100.102.10","TCP","60","443  >  51446 [ACK] Seq=161645 Ack=26356 Win=424 Len=0","0.081126000"
"35971","16.319011","151.101.65.140","10.100.102.10","TCP","60","443  >  51446 [ACK] Seq=161645 Ack=29156 Win=424 Len=0","0.081126000"
"35972","16.319011","151.101.65.140","10.100.102.10","TCP","60","443  >  51446 [ACK] Seq=161645 Ack=33356 Win=424 Len=0","0.081126000"
"35973","16.319011","151.101.65.140","10.100.102.10","TCP","60","443  >  51446 [ACK] Seq=161645 Ack=34871 Win=424 Len=0","0.081126000"
"35976","16.413084","10.100.102.10","151.101.65.140","TCP","54","51446  >  443 [ACK] Seq=34871 Ack=163278 Win=1028 Len=0","0.000279000"
"35989","19.545085","151.101.65.140","10.100.102.10","TCP","60","443  >  51446 [ACK] Seq=163278 Ack=35205 Win=424 Len=0","0.070384000"
"35990","19.545085","151.101.65.140","10.100.102.10","TCP","60","443  >  51446 [ACK] Seq=163278 Ack=38005 Win=424 Len=0","0.070223000"
"35991","19.545085","151.101.65.140","10.100.102.10","TCP","60","443  >  51446 [ACK] Seq=163278 Ack=38155 Win=424 Len=0","0.070223000"
"35997","19.639621","10.100.102.10","151.101.65.140","TCP","54","51446  >  443 [ACK] Seq=38155 Ack=165471 Win=1028 Len=0","0.000164000"
"36060","23.660286","151.101.65.140","10.100.102.10","TCP","60","443  >  51446 [ACK] Seq=165471 Ack=41264 Win=424 Len=0","0.069244000"
"36062","23.661537","151.101.65.140","10.100.102.10","TCP","60","443  >  51446 [ACK] Seq=165471 Ack=44064 Win=424 Len=0","0.070495000"
"36063","23.662142","151.101.65.140","10.100.102.10","TCP","60","443  >  51446 [ACK] Seq=165471 Ack=45938 Win=421 Len=0","0.071100000"
"36067","23.794506","10.100.102.10","151.101.65.140","TCP","54","51446  >  443 [ACK] Seq=45938 Ack=167107 Win=1028 Len=0","0.000150000"
